"Bp Painting Repairs in Reidsville, NC 27320 Painters",9,alpha-painting.com/business/bp-painting-repairs-nc-13290257,3363429699,,,,,,,Reidsville,27320,string,,alpha-painting.com/business/bp-painting-repairs-nc-13290257 Business Name : Bp Painting Repairs Address : 126 Jewell Road Phone Number : (336) 342-9699 Website : Visit Here Category : Painters Year founder : Location type : Single Location Annual Revenue (In Thousands) : $0 to $49.999 SIC : 1721 NAICS : 238320 Industry : Construction We Offer the Following Types of Residential & Commercial Painting Services  
"Bp Painting Repairs in Reidsville, NC 27320 Painters",9,alpha-painting.com/business/bp-painting-repairs-nc-13290257,3363429699,,,,,,,Reidsville,27320,string,,alpha-painting.com/business/bp-painting-repairs-nc-13290257 Business Name : Bp Painting Repairs Address : 126 Jewell Road Phone Number : (336) 342-9699 Website : Visit Here Category : Painters Year founder : Location type : Single Location Annual Revenue (In Thousands) : $0 to $49.999 SIC : 1721 NAICS : 238320 Industry : Construction We Offer the Following Types of Residential & Commercial Painting Services  
"Funes Painting in Clute, TX 77531 Painters",6,alpha-painting.com/business/funes-painting-tx-26138344,7544228035,,,,,,,Fort Lauderdale,33316,string,,"alpha-painting.com/business/funes-painting-tx-26138344 Funes Painting in Clute, TX 77531. Business Name : Funes Painting Address : 349 Hargett St Phone Number : (754) 422-8035 Website : Visit Here Category : Painters Year founder : 2011 Location type : Single Location Annual Revenue (In Thousands) : $50.000 to $99.999 ... Powered by Alpha Painting."
"M & J Painting Services in Madison, SD 57042 Painters",9,alpha-painting.com/business/m-j-painting-services-sd-17746692,6054272843,,,,,,,Madison,57042,string,,"alpha-painting.com/business/m-j-painting-services-sd-17746692 M & J Painting Services in Madison, SD 57042. Business Name : M & J Painting Services Address : 602 North Egan Avenue Phone Number : (605) 427-2843 Website : Visit Here Category : Painters Year founder : 2013 Location type : Single Location ... Powered by Alpha Painting."
"Rice's Painting in Locust Grove, OK 74352 Painters",6,alpha-painting.com/business/rices-painting-ok-16691719,9184795798,,,,,,,Locust Grove,74352,string,,"alpha-painting.com/business/rices-painting-ok-16691719 Rice's Painting in Locust Grove, OK 74352. Business Name : Rice's Painting Address : 1440 North 435 Road Phone Number : (918) 479-5798 Website : Visit Here Category : Painters Year founder : 2011 Location type : Single Location ... Powered by Alpha Painting. Call Us Now! ..."
"Rose Painting in Radcliff, KY 40160 Painters",6,alpha-painting.com/business/rose-painting-ky-8508868,5085868144,,,,,,,"BROCKTON, MA",2302,string,,"alpha-painting.com/business/rose-painting-ky-8508868 Rose Painting in Radcliff, KY 40160. Business Name : Rose Painting Address : 3050 Liberty St Phone Number : (508) 586-8144 Website : Visit Here Category : Painters Year founder : 1996 Location type : Single Location Annual Revenue (In Thousands) : $50.000 to $99.999 ... Powered by Alpha Painting."
"Ross Painting in Livermore, KY 42352 Painters",6,alpha-painting.com/business/ross-painting-ky-8355748,4054012329,,,,,,,Oklahoma City,73163,string,,"alpha-painting.com/business/ross-painting-ky-8355748 Ross Painting in Livermore, KY 42352. Business Name : Ross Painting Address : 11472 State Route 136 East Phone Number : (405) 401-2329 Website : Visit Here Category : Painters Year founder : 2010 Location type : Single Location ... Powered by Alpha Painting. Call Us Now! ..."
"Sadler Painting in Anna, TX 75409 Painters",6,alpha-painting.com/business/sadler-painting-tx-26210226,9035834535,,,,,,,Bonham,75418,string,,"alpha-painting.com/business/sadler-painting-tx-26210226 Sadler Painting in Anna, TX 75409. Business Name : Sadler Painting Address : 324 Pecan Hollow Circle Phone Number : (903) 583-4535 Website : Visit Here Category : Painters Year founder : 2010 Location type : Single Location ... Powered by Alpha Painting. Call Us Now! ..."
"Three T's Painting in Duson, LA 70529 Painters",6,alpha-painting.com/business/three-ts-painting-la-8706494,3378738842,,,,,,,Duson,70529,string,,alpha-painting.com/business/three-ts-painting-la-8706494 Business Name : Three T's Painting Address : 138 Paul Molbert Road Phone Number : (337) 873-8842 Website : Visit Here Category : Painters Year founder : 2011 Location type : Single Location Annual Revenue (In Thousands) : $0 to $49.999 SIC : 1721 NAICS : 238320 Industry : Construction We Offer the Following Types of Residential & Commercial Painting Services  
"Town & Country Painting in Prospect, CT 06712 Painters",6,alpha-painting.com/business/town-country-painting-ct-5289574,2037580874,,,,,,,"WATERBURY, CT",6702,string,,alpha-painting.com/business/town-country-painting-ct-5289574 Business Name : Town & Country Painting Address : 3 Rockridge Terrace Phone Number : (203) 758-0874 Website : Visit Here Category : Painters Year founder : 2010 Location type : Single Location Annual Revenue (In Thousands) : $0 to $49.999 SIC : 1721 NAICS : 238320 Industry : Construction We Offer the Following Types of Residential & Commercial Painting  
"Welch Painting Company in Portland, ME 04101 Painters",6,alpha-painting.com/business/welch-painting-company-me-10404593,2077743013,,,,,,,"SOUTH PORTLAND, ME",4106,string,,alpha-painting.com/business/welch-painting-company-me-10404593 Business Name : Welch Painting Company Address : 89 Vesper St Phone Number : (207) 774-3013 Website : Visit Here Category : Painters Year founder : 2011 Location type : Single Location Annual Revenue (In Thousands) : $50.000 to $99.999 SIC : 1721 NAICS : 238320 Industry : Construction We Offer the Following Types of Residential & Commercial Painting Services  
